{
  "$schema":"https://json-schema.org/draft/2020-12/schema",
  "type":"object",
  "additionalProperties":false,
  "required":["schemaVersion","width","height","fps","duration","background","palette","scenes"],
  "properties":{
    "schemaVersion":{"type":"string"},
    "width":{"type":"integer","minimum":320},
    "height":{"type":"integer","minimum":240},
    "fps":{"type":"integer","minimum":1,"maximum":60},
    "duration":{"type":"number","exclusiveMinimum":0},
    "background":{"type":"string"},
    "palette":{"type":"object","additionalProperties":{"type":"string"}},
    "captionStyle":{"type":"object","additionalProperties":true},
    "captions":{"type":"array","items":{"type":"object","required":["start","end","text"],"properties":{"start":{"type":"number"},"end":{"type":"number"},"text":{"type":"string"}},"additionalProperties":false}},
    "scenes":{"type":"array","minItems":1,"items":{"type":"object","required":["id","start","end","purpose","semanticRefs","visualRule","elements"],"properties":{"id":{"type":"string"},"start":{"type":"number","minimum":0},"end":{"type":"number","exclusiveMinimum":0},"purpose":{"type":"string"},"semanticRefs":{"type":"array","items":{"type":"string"}},"visualRule":{"type":"string"},"elements":{"type":"array","items":{"type":"object","required":["type"],"properties":{"type":{"enum":["rect","circle","line","arrow","text","caption"]},"x":{"type":"number"},"y":{"type":"number"},"width":{"type":"number"},"height":{"type":"number"},"cx":{"type":"number"},"cy":{"type":"number"},"r":{"type":"number"},"x1":{"type":"number"},"y1":{"type":"number"},"x2":{"type":"number"},"y2":{"type":"number"},"fill":{"type":"string"},"stroke":{"type":"string"},"strokeWidth":{"type":"number"},"radius":{"type":"number"},"opacity":{"type":"number"},"fontSize":{"type":"number"},"fontWeight":{"type":["number","string"]},"fontFamily":{"type":"string"},"anchor":{"type":"string"},"text":{"type":"string"},"start":{"type":"number"},"end":{"type":"number"}},"additionalProperties":true}},"additionalProperties":false}}}
  }
}
